{
  "frontier": "prospect_marson_cd4_perturbseq",
  "claim": "The same major-regulator claim, checked against Perturb-seq in two non-immune cells (Replogle K562 and RPE1). Essentiality-artifact regulators replicate across cell types (housekeeping, in both K562 and RPE1); the activation module does not (T-cell-specific). Independent cells validate findings #1 and #3.",
  "kind": "cross_cell_type_transfer",
  "subject": [
    "ABCA3",
    "ABI3",
    "ACACA",
    "ACAD9",
    "ACOT7",
    "ACSL1",
    "ADHFE1",
    "ADPRM",
    "AHR",
    "ALG3",
    "AMBRA1",
    "ANKRD61",
    "ANXA6",
    "APPL2",
    "ARF1",
    "ARF4",
    "ARHGAP27",
    "ARHGAP30",
    "ARID4B",
    "ARL1"
  ],
  "producer": {
    "kind": "finding_producer",
    "model": null,
    "run": "frontier/findings.py"
  },
  "artifacts": [
    {
      "name": "Marson CD4 DE table (classified)",
      "sha256": "60ce305107d8d3d2",
      "locator": "s3://genome-scale-tcell-perturb-seq/marson2025_data/"
    },
    {
      "name": "Replogle K562 DE counts",
      "sha256": "a6a39225748fc683",
      "locator": "figshare:20029387"
    },
    {
      "name": "Replogle RPE1 DE counts",
      "sha256": "fd4e03ea64616f45",
      "locator": "figshare:20029387"
    }
  ],
  "evidence": [
    {
      "fact": "essentiality artifacts replicate in non-immune K562",
      "value": "median 71 DE",
      "source": "ReploglePerturbseqChecker"
    },
    {
      "fact": "the activation module stays inert in K562 (T-cell-specific)",
      "value": "median 4 DE",
      "source": "ReploglePerturbseqChecker"
    }
  ],
  "verifier": {
    "name": "frontier/verify.py",
    "method": "re-derives every object's content id from frozen fields; 0 drift = EXACT lane",
    "replay": "./prospect verify"
  },
  "status": "computationally_reproduced",
  "replayability": "exact",
  "schema_version": "prospect.receipt.v1",
  "conditions": [
    "holds in the released Marson CD4+ CRISPRi assay; not a wet-lab or clinical claim"
  ],
  "verification_requirements": [
    "re-derives every object's content id from frozen fields; 0 drift = EXACT lane",
    "./prospect verify",
    "human_signature_required"
  ],
  "state_diff": {
    "accepted": false,
    "model_can_apply": false,
    "effect": "proposal_only_no_state_mutation"
  },
  "submitter_identity": {
    "kind": "finding_producer",
    "model": null,
    "run": "frontier/findings.py"
  },
  "replay_metadata": {
    "command": "./prospect verify",
    "verifier": "frontier/verify.py",
    "replayability": "exact",
    "frontier": "prospect_marson_cd4_perturbseq"
  },
  "verdicts": [],
  "scope": [
    "holds in the released Marson CD4+ CRISPRi assay; not a wet-lab or clinical claim"
  ],
  "acceptance": {
    "signer": "williamblair",
    "delta_id": "root_a8b0dcdd4024e12f",
    "pubkey": "a864befc0235135dedc81a05c81d256df5b9f69292e5d9a888e3d2d1ec33ae81",
    "signature": "65fdf176afb4ba35158a76ff25ff6bdddad989fa22e171d6b033ec57a29dd44470239c2eea863ce3579fbd14bb1bba5824b92288954adc14566238dee280f600",
    "attestation_type": "legacy_frontier_root_signature",
    "covered_root": "root_a8b0dcdd4024e12f"
  },
  "receipt_id": "rcpt_0bf5d6bad1e96ea8",
  "accepted": true
}