{
  "frontier": "prospect_marson_cd4_perturbseq",
  "claim": "PGGT1B is a proposal-only stimulated primary CD4+ activation-transcriptome hypothesis. Comparable independent replication and donor or batch specificity remain open.",
  "kind": "hypothesis",
  "subject": [
    "PGGT1B"
  ],
  "producer": {
    "kind": "autonomous_agent",
    "model": "claude-opus-4-8",
    "run": "12 tool calls / 3 rounds"
  },
  "artifacts": [
    {
      "name": "Marson CD4 DE table (classified)",
      "sha256": "60ce305107d8d3d2",
      "locator": "s3://genome-scale-tcell-perturb-seq/marson2025_data/"
    },
    {
      "name": "Replogle K562 DE counts",
      "sha256": "a6a39225748fc683",
      "locator": "figshare:20029387"
    },
    {
      "name": "CollecTRI regulons",
      "sha256": "9e065f57f3da52b1",
      "locator": "omnipathdb.org"
    },
    {
      "name": "PGGT1B defended evidence",
      "sha256": "615e41c0bf30214e",
      "locator": "examples/data/pggt1b_defended_evidence.json"
    }
  ],
  "evidence": [
    {
      "fact": "PGGT1B has on-target knockdown and high Stim8hr reach",
      "value": "3014 DE genes",
      "source": "MarsonPerturbseqChecker"
    },
    {
      "fact": "PGGT1B has lower Rest reach",
      "value": "175 DE genes",
      "source": "MarsonPerturbseqChecker"
    },
    {
      "fact": "PGGT1B has low K562 reach",
      "value": "1 DE gene",
      "source": "ReploglePerturbseqChecker"
    },
    {
      "fact": "public PGGT1B comparators use non-matching readouts",
      "value": "Shifrut and Schmidt: orthogonal_phenotype",
      "source": "frontier/pggt1b_comparability_audit.py"
    }
  ],
  "verifier": {
    "name": "frozen-data tools",
    "method": "every fact is a deterministic lookup against a released table; the agent cannot assert ungated biology",
    "replay": "./prospect agent"
  },
  "status": "evidence_attached",
  "replayability": "attested",
  "schema_version": "prospect.receipt.v1",
  "conditions": [
    "It has no annotated regulon and is not a known TF, yet its knockdown reshapes thousands of genes only upon stimulation and only in T cells, pointing to an under-appreciated, likely prenylation-mediated regulatory role rather than a housekeeping or canonical T-cell function.",
    "a hypothesis to test, not an established result"
  ],
  "verification_requirements": [
    "every fact is a deterministic lookup against a released table; the agent cannot assert ungated biology",
    "./prospect agent",
    "human_signature_required"
  ],
  "state_diff": {
    "accepted": false,
    "model_can_apply": false,
    "effect": "proposal_only_no_state_mutation"
  },
  "submitter_identity": {
    "kind": "autonomous_agent",
    "model": "claude-opus-4-8",
    "run": "12 tool calls / 3 rounds"
  },
  "replay_metadata": {
    "command": "./prospect agent",
    "verifier": "frozen-data tools",
    "replayability": "attested",
    "frontier": "prospect_marson_cd4_perturbseq"
  },
  "verdicts": [],
  "scope": [
    "It has no annotated regulon and is not a known TF, yet its knockdown reshapes thousands of genes only upon stimulation and only in T cells, pointing to an under-appreciated, likely prenylation-mediated regulatory role rather than a housekeeping or canonical T-cell function.",
    "a hypothesis to test, not an established result"
  ],
  "acceptance": {
    "signer": "williamblair",
    "delta_id": "hyp_0addda00f039f198",
    "pubkey": "a864befc0235135dedc81a05c81d256df5b9f69292e5d9a888e3d2d1ec33ae81",
    "signature": "59eb0b86c3d7e7f39083d6932e0a36e2f8508dc59623ad82f19a011209d50fc734c744f8e6a8e0391febaf5d52e54844b6faa4d9515cbff91b494825b94e6e0c",
    "attestation_type": "legacy_frontier_root_signature",
    "covered_root": "hyp_0addda00f039f198"
  },
  "receipt_id": "rcpt_b4f36fd7c042f0bb",
  "accepted": false
}