{
  "frontier": "prospect_marson_cd4_perturbseq",
  "claim": "High Rest reach argues against activation specificity, but does not by itself establish housekeeping or essentiality. The GSE278572 proposal qualifies MED12.",
  "kind": "essentiality_artifact",
  "subject": [
    "ABI3",
    "AHR",
    "AKR1C1",
    "ARF1",
    "ARHGAP30",
    "ARNT",
    "ATAD5",
    "ATP2A2",
    "ATXN10",
    "BRD8",
    "BRPF1",
    "BTAF1",
    "C11orf54",
    "CASC3",
    "CCDC12",
    "CCNC",
    "CCND2",
    "CDC25B",
    "CHD4",
    "CHD7"
  ],
  "producer": {
    "kind": "finding_producer",
    "model": null,
    "run": "frontier/findings.py"
  },
  "artifacts": [
    {
      "name": "Marson CD4 DE table (classified)",
      "sha256": "60ce305107d8d3d2",
      "locator": "s3://genome-scale-tcell-perturb-seq/marson2025_data/"
    }
  ],
  "evidence": [
    {
      "fact": "TADA2B has high transcriptome reach in a resting cell",
      "value": "4681 DE at Rest",
      "source": "MarsonPerturbseqChecker"
    },
    {
      "fact": "UBXN1 has high transcriptome reach in a resting cell",
      "value": "4440 DE at Rest",
      "source": "MarsonPerturbseqChecker"
    }
  ],
  "verifier": {
    "name": "frontier/verify.py",
    "method": "re-derives every object's content id from frozen fields; 0 drift = EXACT lane",
    "replay": "./prospect verify"
  },
  "status": "computationally_reproduced",
  "replayability": "exact",
  "schema_version": "prospect.receipt.v1",
  "conditions": [
    "holds in the released Marson CD4+ CRISPRi assay; not a wet-lab or clinical claim"
  ],
  "verification_requirements": [
    "re-derives every object's content id from frozen fields; 0 drift = EXACT lane",
    "./prospect verify",
    "human_signature_required"
  ],
  "state_diff": {
    "accepted": false,
    "model_can_apply": false,
    "effect": "proposal_only_no_state_mutation"
  },
  "submitter_identity": {
    "kind": "finding_producer",
    "model": null,
    "run": "frontier/findings.py"
  },
  "replay_metadata": {
    "command": "./prospect verify",
    "verifier": "frontier/verify.py",
    "replayability": "exact",
    "frontier": "prospect_marson_cd4_perturbseq"
  },
  "verdicts": [],
  "scope": [
    "holds in the released Marson CD4+ CRISPRi assay; not a wet-lab or clinical claim"
  ],
  "acceptance": {
    "signer": "williamblair",
    "delta_id": "root_a8b0dcdd4024e12f",
    "pubkey": "a864befc0235135dedc81a05c81d256df5b9f69292e5d9a888e3d2d1ec33ae81",
    "signature": "65fdf176afb4ba35158a76ff25ff6bdddad989fa22e171d6b033ec57a29dd44470239c2eea863ce3579fbd14bb1bba5824b92288954adc14566238dee280f600",
    "attestation_type": "legacy_frontier_root_signature",
    "covered_root": "root_a8b0dcdd4024e12f"
  },
  "receipt_id": "rcpt_7a291c0181112e02",
  "accepted": false
}