{
  "frontier": "prospect_marson_cd4_perturbseq",
  "claim": "The TCR-proximal signaling cascade is silent in a resting cell and becomes the regulatory core of the transcriptome only after stimulation. The screen recovers this module from knockout effects with no prior pathway knowledge.",
  "kind": "activation_module",
  "subject": [
    "ABCA3",
    "ACACA",
    "ACAD9",
    "ACOT7",
    "ACSL1",
    "ADHFE1",
    "ADPRM",
    "ALG3",
    "AMBRA1",
    "ANKRD61",
    "ANXA6",
    "APPL2",
    "ARF4",
    "ARHGAP27",
    "ARID4B",
    "ARL1",
    "ARL6IP1",
    "ATAD3A",
    "ATP6AP2",
    "AVEN"
  ],
  "producer": {
    "kind": "finding_producer",
    "model": null,
    "run": "frontier/findings.py"
  },
  "artifacts": [
    {
      "name": "Marson CD4 DE table (classified)",
      "sha256": "60ce305107d8d3d2",
      "locator": "s3://genome-scale-tcell-perturb-seq/marson2025_data/"
    }
  ],
  "evidence": [
    {
      "fact": "CD3E is silent at rest, fires on stimulation",
      "value": "Rest 4 DE -> Stim 5711 DE",
      "source": "MarsonPerturbseqChecker"
    },
    {
      "fact": "LAT is silent at rest, fires on stimulation",
      "value": "Rest 4 DE -> Stim 5536 DE",
      "source": "MarsonPerturbseqChecker"
    }
  ],
  "verifier": {
    "name": "frontier/verify.py",
    "method": "re-derives every object's content id from frozen fields; 0 drift = EXACT lane",
    "replay": "./prospect verify"
  },
  "status": "computationally_reproduced",
  "replayability": "exact",
  "schema_version": "prospect.receipt.v1",
  "conditions": [
    "holds in the released Marson CD4+ CRISPRi assay; not a wet-lab or clinical claim"
  ],
  "verification_requirements": [
    "re-derives every object's content id from frozen fields; 0 drift = EXACT lane",
    "./prospect verify",
    "human_signature_required"
  ],
  "state_diff": {
    "accepted": false,
    "model_can_apply": false,
    "effect": "proposal_only_no_state_mutation"
  },
  "submitter_identity": {
    "kind": "finding_producer",
    "model": null,
    "run": "frontier/findings.py"
  },
  "replay_metadata": {
    "command": "./prospect verify",
    "verifier": "frontier/verify.py",
    "replayability": "exact",
    "frontier": "prospect_marson_cd4_perturbseq"
  },
  "verdicts": [],
  "scope": [
    "holds in the released Marson CD4+ CRISPRi assay; not a wet-lab or clinical claim"
  ],
  "acceptance": {
    "signer": "williamblair",
    "delta_id": "root_a8b0dcdd4024e12f",
    "pubkey": "a864befc0235135dedc81a05c81d256df5b9f69292e5d9a888e3d2d1ec33ae81",
    "signature": "65fdf176afb4ba35158a76ff25ff6bdddad989fa22e171d6b033ec57a29dd44470239c2eea863ce3579fbd14bb1bba5824b92288954adc14566238dee280f600",
    "attestation_type": "legacy_frontier_root_signature",
    "covered_root": "root_a8b0dcdd4024e12f"
  },
  "receipt_id": "rcpt_204a55aadad0acb6",
  "accepted": false
}