{
  "frontier": "prospect_marson_cd4_perturbseq",
  "claim": "Eighteen field-targeted genes have effective knockdown but near-zero stimulated transcriptome reach in this assay. The result limits a broad causal-driver claim for this readout.",
  "kind": "regulator_vs_effector",
  "subject": [
    "BTLA",
    "CD4",
    "CD40LG",
    "CD6",
    "CTLA4",
    "DGKA",
    "HAVCR2",
    "IFNG",
    "IL10",
    "IL2",
    "LAG3",
    "PDCD1",
    "PTPN22",
    "SELL",
    "SOCS1",
    "STAT1",
    "TGFB1",
    "TNF"
  ],
  "producer": {
    "kind": "finding_producer",
    "model": null,
    "run": "frontier/findings.py"
  },
  "artifacts": [
    {
      "name": "Marson CD4 DE table (classified)",
      "sha256": "60ce305107d8d3d2",
      "locator": "s3://genome-scale-tcell-perturb-seq/marson2025_data/"
    }
  ],
  "evidence": [
    {
      "fact": "PDCD1 knockdown moves near-zero genes despite working KD",
      "value": "1 DE in Stim8hr",
      "source": "MarsonPerturbseqChecker"
    },
    {
      "fact": "HAVCR2 knockdown moves near-zero genes despite working KD",
      "value": "1 DE in Stim8hr",
      "source": "MarsonPerturbseqChecker"
    },
    {
      "fact": "IL2 knockdown moves near-zero genes despite working KD",
      "value": "2 DE in Stim8hr",
      "source": "MarsonPerturbseqChecker"
    }
  ],
  "verifier": {
    "name": "frontier/verify.py",
    "method": "re-derives every object's content id from frozen fields; 0 drift = EXACT lane",
    "replay": "./prospect verify"
  },
  "status": "computationally_reproduced",
  "replayability": "exact",
  "schema_version": "prospect.receipt.v1",
  "conditions": [
    "holds in the released Marson CD4+ CRISPRi assay; not a wet-lab or clinical claim"
  ],
  "verification_requirements": [
    "re-derives every object's content id from frozen fields; 0 drift = EXACT lane",
    "./prospect verify",
    "human_signature_required"
  ],
  "state_diff": {
    "accepted": false,
    "model_can_apply": false,
    "effect": "proposal_only_no_state_mutation"
  },
  "submitter_identity": {
    "kind": "finding_producer",
    "model": null,
    "run": "frontier/findings.py"
  },
  "replay_metadata": {
    "command": "./prospect verify",
    "verifier": "frontier/verify.py",
    "replayability": "exact",
    "frontier": "prospect_marson_cd4_perturbseq"
  },
  "verdicts": [],
  "scope": [
    "holds in the released Marson CD4+ CRISPRi assay; not a wet-lab or clinical claim"
  ],
  "acceptance": {
    "signer": "williamblair",
    "delta_id": "root_a8b0dcdd4024e12f",
    "pubkey": "a864befc0235135dedc81a05c81d256df5b9f69292e5d9a888e3d2d1ec33ae81",
    "signature": "65fdf176afb4ba35158a76ff25ff6bdddad989fa22e171d6b033ec57a29dd44470239c2eea863ce3579fbd14bb1bba5824b92288954adc14566238dee280f600",
    "attestation_type": "legacy_frontier_root_signature",
    "covered_root": "root_a8b0dcdd4024e12f"
  },
  "receipt_id": "rcpt_789f6deab754663b",
  "accepted": false
}